{
  "schema_version": "0.1",
  "processing_id": "OK-20260922-000149",
  "request_ref": {
    "tpa_claim_id": "CLM-2026-004472",
    "tpa_batch_id": "BATCH-20260922-A",
    "policy_id": "POL-002",
    "member_id": "MBR-0188",
    "product_code": "HEALTH-01",
    "received_at": "2026-09-22T08:15:10+07:00"
  },
  "line_of_business": "health",
  "engine": {
    "provider": "OneKlinik",
    "engine_version": "1.4.0",
    "ruleset_version": "TC-HEALTH-v1.0",
    "processing_region": "asia-southeast2 (Jakarta)"
  },
  "documents": [
    {
      "document_id": "CLM-2026-004472_resume.jpg",
      "document_type": "medical_resume",
      "pages": 1,
      "extraction_quality": { "score": 0.41, "legible": false, "issues": ["blurry", "handwritten", "cropped"] },
      "fields": [
        { "name": "diagnosis_text", "value": null, "confidence": 0.22, "source": { "page": 1, "bbox": [0.11, 0.38, 0.55, 0.04] } }
      ]
    },
    {
      "document_id": "CLM-2026-004472_invoice.pdf",
      "document_type": "invoice",
      "pages": 1,
      "extraction_quality": { "score": 0.93, "legible": true, "issues": [] },
      "fields": [
        { "name": "invoice_total",   "value": 21300000, "confidence": 0.97, "source": { "page": 1, "bbox": [0.60, 0.74, 0.26, 0.03] } },
        { "name": "admission_date",  "value": "2026-08-30", "confidence": 0.94, "source": { "page": 1, "bbox": [0.13, 0.20, 0.18, 0.02] } }
      ]
    }
  ],
  "policy_evaluation": {
    "benefit_code": "IP-001",
    "rules": [
      {
        "rule_id": "HEALTH-STATUS-001",
        "description": "Peserta berstatus aktif pada tanggal pelayanan.",
        "verdict": "pass",
        "source_clause": { "reference": "TC Health Pasal 4" },
        "evidence": [ { "document_id": "CLM-2026-004472_invoice.pdf", "page": 1 } ],
        "evaluated_at": "2026-09-22T08:15:38+07:00"
      },
      {
        "rule_id": "HEALTH-PERIOD-003",
        "description": "Tanggal pelayanan berada dalam periode pertanggungan.",
        "verdict": "indeterminate",
        "source_clause": { "reference": "TC Health Pasal 3", "text": "Klaim dengan tanggal pelayanan di luar periode pertanggungan tidak dijamin, kecuali terdapat ketentuan khusus, continuation, extension, atau endorsement yang berlaku." },
        "evidence": [ { "document_id": "CLM-2026-004472_invoice.pdf", "page": 1, "note": "Tanggal masuk 2026-08-30 berselisih dua hari dari tanggal mulai polis. Perlu pengecekan endorsement." } ],
        "evaluated_at": "2026-09-22T08:15:39+07:00"
      },
      {
        "rule_id": "HEALTH-EXCL-012",
        "description": "Diagnosis tidak termasuk dalam daftar pengecualian polis.",
        "verdict": "indeterminate",
        "source_clause": { "reference": "TC Health Pasal 12" },
        "evidence": [ { "document_id": "CLM-2026-004472_resume.jpg", "page": 1, "note": "Diagnosis tidak terbaca. Resume medis buram dan sebagian terpotong." } ],
        "evaluated_at": "2026-09-22T08:15:39+07:00"
      }
    ]
  },
  "assessment": {
    "recommendation": "needs_human_review",
    "confidence": 0.31,
    "reasons": [
      { "rule_id": "HEALTH-EXCL-012",   "summary": "Diagnosis tidak terbaca, sehingga pengecualian tidak dapat dinilai." },
      { "rule_id": "HEALTH-PERIOD-003", "summary": "Tanggal pelayanan berdekatan dengan awal periode dan perlu konfirmasi endorsement." }
    ],
    "human_review": {
      "required": true,
      "triggers": ["illegible_document", "event_date_unclear", "low_extraction_confidence"],
      "notes": "Engine tidak mengeluarkan rekomendasi setuju atau tolak karena dua aturan penting berstatus indeterminate. Keputusan diserahkan ke analis.",
      "missing_items": [
        "Resume medis yang terbaca jelas, memuat diagnosis dan kode ICD-10",
        "Konfirmasi tanggal mulai pertanggungan dan endorsement yang berlaku"
      ]
    }
  },
  "audit": {
    "received_at": "2026-09-22T08:15:10+07:00",
    "completed_at": "2026-09-22T08:15:41+07:00",
    "processing_seconds": 31.2,
    "model_reference": "ok-claim-health-2026.09",
    "input_digest": "sha256:1f7a44c2e08b6d95a3c17e42b0d98fa6c5e31b7d82409f6ea1c73d50b8e2416c"
  },
  "retention": {
    "policy": "zero_retention",
    "content_deleted": true,
    "deleted_at": "2026-09-22T08:15:42+07:00",
    "log_retained": "processing_id, timestamp, jumlah halaman, status. Tanpa isi medis dan tanpa data pribadi."
  }
}
